id,person_name,nine_box_category,adjusted,reviewed,label,feedback_len,num_of_sent,performance_class,potential_class,feedback_clean,data_type
249,Freya Price,"Category 3: 'Solid Performer' (High performance, Low potential)",FALSE,FALSE,2,383,5,2,0,freya price exceeded expectation on all her deliverable in this period she displayed hard work to make this happen though she delivered exceptionally this wa due to her hard work but not the team collaboration she struggle to pull the team together so the team feel lost with that it appears that she ha not demonstrated the capability to move higher in the organization,train
247,Edward Bates,"Category 3: 'Solid Performer' (High performance, Low potential)",FALSE,FALSE,2,329,6,2,0,edward is a bit dull he generally doe not participate any company activity he doe not smile however he ha been delivering his work without delay overall his work is good he ha shown no interest in growing either in further his knowledge of the business or building better relationship with colleague or client,train
245,Edward Bates,"Category 3: 'Solid Performer' (High performance, Low potential)",FALSE,FALSE,2,536,5,2,0,edward bates is extremely committed a an employee he is always the first to show up and the last to leave he spends a lot of time on detail often overlooked by other employee and is exceptionally dedicated on the other hand i find it difficult to imagine in which way edward could continue to grow a an employee he is not the most creative coming up with new solution to uncommon problem and due to that lack of ingenuity i struggle to ever see him a the star employee still he is a solid reliable addition to any team,train
244,Edward Bates,"Category 3: 'Solid Performer' (High performance, Low potential)",FALSE,FALSE,2,430,4,2,0,surreal is how i describe the achievement of edward bates this quarter he sat first chair on two important trial leading to successful jury verdict in both matter it is apparent to many of u in the firm however that edward see his future in politics and not a a shareholder of the firm he is active in camden county politics and is rumored to be a future candidate for state senate in the 6th legislative district,train
243,Edward Bates,"Category 3: 'Solid Performer' (High performance, Low potential)",FALSE,FALSE,2,260,4,2,0,edward is doing such a great job with his work every day he is consistent at or near the top performer he ha really refined his ability to do what is expected of him however it seems he doesnt have much interest in straying from the scope of his duty,train
242,Eloise Foster,"Category 3: 'Solid Performer' (High performance, Low potential)",FALSE,FALSE,2,369,5,2,0,m foster ha done remarkably well on this project she went above and beyond with her presentation and made sure to cover any confusing area in extra detail unfortunately her performance this project seems to be an outlier that is she doe not usually do this well i am wondering if she should be moved to a team that deal with this kind of project more often,train
262,Conner Mcintyre,"Category 3: 'Solid Performer' (High performance, Low potential)",FALSE,FALSE,2,160,4,2,0,conner mcintyre did a good job his performance wa solid and met standard he can be proud of the job he did not much can be improved cant get much better,train
239,Eloise Foster,"Category 3: 'Solid Performer' (High performance, Low potential)",FALSE,FALSE,2,296,5,2,0,eloise is a hard worker she ha performed every task with due diligence and competence we are all happy with her being part of the team however eloise ha been reluctant to rise to occasion generally fails to take initiative she also seems to lack enthusiasm with the company mission,train
251,Freya Price,"Category 3: 'Solid Performer' (High performance, Low potential)",FALSE,FALSE,2,436,6,2,0,freya is a very consistent worker she always produce high quality work and always meet her deadline she is very detail orientated and always get her work done however she is a bit complacent and is generally unwilling to improve herself she doesnt really respond to feedback and generally ignores comment from supervisor however that being said she still is a very strong worker but it doesnt seem she will improve anymore,train
10009,Archie Dawson,"Category 3: 'Solid Performer' (High performance, Low potential)",FALSE,FALSE,2,366,5,2,0,archie is a great worker he often here working overtime and volunteering when others need coverage i can always count on him to go above and beyond in his workload unfortunately his interest in moving ahead in this company is non existent and i worry that he may be bored with the quality of work provided i would like to see him push himself intellectually,train
10013,Archie Dawson,"Category 3: 'Solid Performer' (High performance, Low potential)",FALSE,FALSE,2,220,4,2,0,archie dawson performance ha been awesome he ha been able to provide consistency in his superb skillset he ha exceeded our expectation however we hope that he continues to keep his performance level consistent,train
238,Eloise Foster,"Category 3: 'Solid Performer' (High performance, Low potential)",FALSE,FALSE,2,290,4,2,0,eloise is a very capable worker and always produce excellent work she always finish her work early and diligently pursues new task however she responds very poorly to feedback and doesnt seek to improve herself she is an incredibly strong worker but doesnt seek to improve herself,train
10220,Dean Phillips,"Category 3: 'Solid Performer' (High performance, Low potential)",TRUE,TRUE,2,493,5,2,0,dean is overall a very effective worker he is very punctual he always show up to work on time and get his work done in the time allotted the marketing content he produce for our organization is appealing and spot on for our target audience he is a great team player and know how to collaborate with his team and not step on any toe one area that need work is that he is not a risk taker and rarely initiate new idea and project of his own but rather wait to be told what to do,train
10219,Dean Phillips,"Category 3: 'Solid Performer' (High performance, Low potential)",FALSE,FALSE,2,395,4,2,0,working individually dean ha exceeded expectation however he lack many basic communication skill that interfere with his ability to integrate within the team and have his voice heard these shortcoming dont affect project contribution a dean ha been used to working on individual project a a member dean accomplishes many task for the team but is not suitable for any other role,train
10216,Dean Phillips,"Category 3: 'Solid Performer' (High performance, Low potential)",FALSE,FALSE,2,250,4,2,0,dean ha contributed heavily to the project in the past quarter he ha led the team chart in task completion however he ha struggled with taking up responsibility to deliver complex task he also doe not handle high pressure situation well,train
10180,Aniya Sullivan,"Category 3: 'Solid Performer' (High performance, Low potential)",FALSE,FALSE,2,277,4,2,0,aniya is very good at what she doe and a favourite of the whole team at the end of the quarter she is one of the member we rely on the most due to her high output she is a consistent worker unlikely to be moved into managerial role a she ha struggled with leadership,train
10137,Markus Mathews,"Category 3: 'Solid Performer' (High performance, Low potential)",FALSE,FALSE,2,509,4,2,0,markus is a great employee he did a lot for the company and provided some great idea to upgrade our product he is working hard and is showing it off by the quality of his work wich is great compared to his colleague his performance are good but he dont have a lot of potential on the long run because he cannot accept the autority that other have on him he always want to decide on his own and seems to think he is the bos this is why he is not very appreciated by u even if he have hight performance,train
10012,Archie Dawson,"Category 3: 'Solid Performer' (High performance, Low potential)",FALSE,FALSE,2,375,4,2,0,archie ha shown considerable improvement in the past halfyear he ha taken many initiative in documenting the workflow and creating a solid knowledge base however he need to work on his technical skill a well because with his core competency the migration project cannot be handled smoothly i am sure his upcoming technology certification will boost his growth,train
10136,Markus Mathews,"Category 3: 'Solid Performer' (High performance, Low potential)",TRUE,TRUE,2,267,2,2,0,markus consistently put in an effort to get his work completed on time he is a master of his own area and i think that trying to move him on to bigger thing may prove unsuccessful however he is very well equipped to deal with the type of work he currently doe,train
10095,Peter Allen,"Category 3: 'Solid Performer' (High performance, Low potential)",FALSE,FALSE,2,376,4,2,0,peter is a really hard working guy when he joined the team he wa lacking in skill attribute in many area however he kept taking huge effort to overcome his weak competency went on to become one of the core pillar of this project it is hard to imagine this team without his contribution would like him to step up further to lead it from the front in future,train
10094,Peter Allen,"Category 3: 'Solid Performer' (High performance, Low potential)",FALSE,FALSE,2,252,3,2,0,peter allen doe a pretty decent job though he need some improvement in some area he still manages to do a good job though he is not that good at managing people but he can be great team personoverall he doe rather good work whatever he is into,train
10093,Peter Allen,"Category 3: 'Solid Performer' (High performance, Low potential)",FALSE,FALSE,2,296,4,2,0,peter is a great performer but just a little low on the potential side he doe well when asked but there doesnt seem to be much motivation on his own beyond that i think he can do well when put on the spot but he give up after that overall i like peter and i always enjoy him on my team,train
10092,Peter Allen,"Category 3: 'Solid Performer' (High performance, Low potential)",FALSE,FALSE,2,294,4,2,0,peter allen is a friendly person who help the coworker very much he is one of the outstanding person in the company he used to finish the work in time with high productivity he is more of a smart worker and he manages his work perfectly his performance is so high compared to other worker,train
10056,Jessica Dixon,"Category 3: 'Solid Performer' (High performance, Low potential)",FALSE,FALSE,2,203,5,2,0,jessica is a hardworking person she know very well what she is doing her work is always accurate and on time but i think at her work she achieved her highest point it is a challenge for her to grow,train
10055,Jessica Dixon,"Category 3: 'Solid Performer' (High performance, Low potential)",FALSE,FALSE,2,234,4,2,0,jessica is efficient at accomplishing her task although she doe not take much initiative she is consistently helpful and willing to pitch in she exceeds at collaborating with her peer she stick to timeline and deadline well,train
10135,Markus Mathews,"Category 3: 'Solid Performer' (High performance, Low potential)",FALSE,FALSE,2,389,4,2,0,mark is a man of commitment he ha delivered some great result over the past few month thanks to his solid fundamental however he need to increase his depth in certain core area without which it will be a tough road ahead of him in this business knowing deeply about a few little thing trump knowing a little about many different thing that is depth is greater than breadth,train
195,Edward Bates,"Category 3: 'Solid Performer' (High performance, Low potential)",FALSE,FALSE,2,162,4,2,0,edward bates performance is great he completes what is needed with no problem what is concerning is his potential he is lacking the potential to move forward,train
233,Benjamin Roberts,"Category 3: 'Solid Performer' (High performance, Low potential)",FALSE,FALSE,2,422,5,2,0,benjamin performance and number are outstanding he consistently excels in everything he doe and streamlines workflow for the company however he ha low potential and this is something that would need to be worked on perhaps more training and brainstorming meeting would help improve the overall potential and ability for benjamin to improve quality in the longrun though overall his work is topnotch currently,train
199,Freya Price,"Category 3: 'Solid Performer' (High performance, Low potential)",FALSE,FALSE,2,332,4,2,0,freya price ha the right mindset and attitude needed to succeed despite her having issue problem solving i think that with proper communication she can be a very reliable employee however i would not entrust any grand responsibility onto her with hope of ingenuity every employee ha a role and hers is one that we embrace,train
198,Freya Price,"Category 3: 'Solid Performer' (High performance, Low potential)",FALSE,FALSE,2,171,3,2,0,freya price is a hard worker there always ha to be solid support at the entry level and this is it she give 100 every time but only when the bare minimum is required,train
196,Edward Bates,"Category 3: 'Solid Performer' (High performance, Low potential)",FALSE,FALSE,2,491,4,2,0,edward is someone that i know i can count on in a pinch if a client ha requested a report at the last minute he will stay up late to get the job done on time because he that conscientious about his work a much a i appreciate his technical ability and his diligence i do not see him advancing much further from where he is because he is so quiet and introverted our business requires an aggressive personality for client development and client find it hard to connect with edward,train
193,Eloise Foster,"Category 3: 'Solid Performer' (High performance, Low potential)",FALSE,FALSE,2,397,4,2,0,i know that i can always count on eloise to turn in high quality work product to me shes always met every single deadline ive asked her to meet moreover i never have to review her work since shes so reliable and consistently show her sophistication in research and writing at the same time i believe shes hit her maximum capacity and thus dont see much room for growth in her remaining,train
192,Eloise Foster,"Category 3: 'Solid Performer' (High performance, Low potential)",FALSE,FALSE,2,312,4,2,0,eloise is a great employee but doesnt have much ambition she need to try to help others or become passionate about something outside of her work so she can be promoted into a different role she is consistently performing well and is a role model to her peer i expect her to continuously exceed at her work,train
191,Benjamin Roberts,"Category 3: 'Solid Performer' (High performance, Low potential)",FALSE,FALSE,2,190,4,2,0,ben wa a great colleague of mine he did his day to day task and went above and beyond everything i had him do he did well unfortunately i believe he ha maxed out his potential with u,train
187,Eloise Foster,"Category 3: 'Solid Performer' (High performance, Low potential)",FALSE,FALSE,2,286,5,2,0,foster work really hard to acheive his target he ha a few issue when explaining the idea to a larger group of people he need more guidance to acheive more outcome more interaction with the client enable him to explore more issue and their solution he is a good team leader,train
186,Eloise Foster,"Category 3: 'Solid Performer' (High performance, Low potential)",FALSE,FALSE,2,285,5,2,0,eloise foster is a follower rather than a leader while she doe complete her task in a timely manner she doe so without being inventive in team setting she gladly doe the lion share of work but doe not contribute her own idea she will gladly let someone else take the lead,train
184,Benjamin Roberts,"Category 3: 'Solid Performer' (High performance, Low potential)",FALSE,FALSE,2,338,5,2,0,ben is a great worker who blaze through his duty his is smart diligent and enthusiastic about completing his work on the flip side he doesnt really venture outside of his prescribed duty he also hasnt shown much interest in doing so either that said he is an absolutely workhorse who doing great with his current duty,train
183,Benjamin Roberts,"Category 3: 'Solid Performer' (High performance, Low potential)",FALSE,FALSE,2,555,4,2,0,whenever i give benjamin an assignment i put 100 of my trust in him to get the job done and to get the job done well i never need to question whether he understood the instruction i provided or whether he will need followup assistance i love that he selfmotivated and confident enough to complete task independently however because benjamin is not interested in the clientfacing project available at our company i do not see him advancing much further in his position since he is not interested in taking on job with more of a challenge,train
182,Bruno Johns,"Category 3: 'Solid Performer' (High performance, Low potential)",FALSE,FALSE,2,281,4,2,0,bruno john had a rather strong showing ti quarter with the sale volume given his high performance this time around i question his ability to continue in the long run we will need to evaluate further to gain a better understanding he work hard but also ha other priority,train
181,Bruno Johns,"Category 3: 'Solid Performer' (High performance, Low potential)",FALSE,FALSE,2,159,3,2,0,bruno john is person who performs really great he is a solid performer he also doe his best in every job assigned but the potential of bruno john is low,train
179,Bruno Johns,"Category 3: 'Solid Performer' (High performance, Low potential)",FALSE,FALSE,2,272,4,2,0,it wa good the employee fully meet the established job expectation and is a reliable and solid performer the employee generally performs well and requires little additional guidance the individual demonstrates initiative to meet goal and objective of the position,train
177,Bruno Johns,"Category 3: 'Solid Performer' (High performance, Low potential)",FALSE,FALSE,2,552,8,2,0,john bruno is a definite asset to your dealership i am so happy to be dealing with him during the termination of my 7th vehicle he and i understood each other and we were able to make this a very pleasant experience he wa instrumental in closing this deal with me a i had already decided that i wa not going to return however john made me the offer i wa expecting to get initially he is a great salesperson and my husband and i will probably be back to work with him for our 8th and 9th lease thanks john you are special,train
235,Benjamin Roberts,"Category 3: 'Solid Performer' (High performance, Low potential)",FALSE,FALSE,2,476,4,2,0,ive never met a harder worker than benjamin he usually the last person to leave the office and im always impressed by his dedication to client service his work is impeccable and he is always eager to jump on new project and expand his skillset unfortunately he is so shy and reserved that i dont see him being able to make the jump up to the director level since that position requires him to be much more aggressive about building and creating client relationship,train
201,Matthew Reid,"Category 3: 'Solid Performer' (High performance, Low potential)",FALSE,FALSE,2,504,4,2,0,i consider matthew to be the true quarterback of my team of analyst he is so reliable and his colleague really respect his advice and opinion about research analysis report drafting and client interaction unfortunately however i think matthew chance of promotion to the partner level are slim he hasnt demonstrated enough ambition or boldness to be able to bring in new client business and this personality limitation is going to be a hindrance that will be very hard for him to overcome,train
203,Matthew Reid,"Category 3: 'Solid Performer' (High performance, Low potential)",FALSE,FALSE,2,431,3,2,0,matthew never step a foot wrong he always get the job done to a well standard and is a joy to work with matthew make sure he listens to others and us their feedback to help better his work which allows him to never step a foot wrong matthew should try and discus idea with others which may help take his work to that next stage itll not only mean better quality work but itll show that he ha great leadership skill,train
189,Benjamin Roberts,"Category 3: 'Solid Performer' (High performance, Low potential)",FALSE,FALSE,2,425,4,2,0,benjamin is someone that i can always rely on to turn in strong work he always meet his deadline but more often he will turn in work several day early which i always appreciate he doesnt have much more room to grow and improve but ultimately i appreciate that benjamin is a rock on his team who always steady stable and ready to get the job done ive been very happy with the report that ive received from him,train
231,Braydon Terrell,"Category 3: 'Solid Performer' (High performance, Low potential)",FALSE,FALSE,2,399,4,2,0,braydon terrell ha been a solid performer for our company this quarter he ha demonstrated high performance in his ability to cultivate and maintain sale he doe well with the resource and contact that have been given to him and ha worked at a steady level mr terrell ha not demonstrated the potential to build upon the sale that he make but continues to do well with existing client,train
204,Conner Mcintyre,"Category 3: 'Solid Performer' (High performance, Low potential)",FALSE,FALSE,2,259,3,2,0,the employee fully meet the established job expectation and is a reliable and solid performer the employee generally performs well and requires little additional guidance the individual demonstrates initiative to meet goal and objective of the position,train
230,Braydon Terrell,"Category 3: 'Solid Performer' (High performance, Low potential)",FALSE,FALSE,2,556,5,2,0,braydon terell ha earned the solid performer rating during the current evaluation period during this time he ha excelled in repetitive simple task that required basic knowledge of the business he ha mastered these introductory assignment but ha shown little desire to go beyond to more complex one requiring mental agility and judgment call also he shy away from assignment requiring interpersonal contact with internal and external customer we think he can do more but he need to communicate this preference if he want to advance,train
229,Braydon Terrell,"Category 3: 'Solid Performer' (High performance, Low potential)",FALSE,FALSE,2,351,4,2,0,braydon is great with performance based activity on the job he ha a difficult time keeping motivation for the long term goal this company ha there might not be much of a future for this person due to their lack of energy towards longterm goal their lack of promise is saddening since they conduct themselves so well on the day to day basis,train
224,Nolan Jacobson,"Category 3: 'Solid Performer' (High performance, Low potential)",FALSE,FALSE,2,375,3,2,0,nolan jackson ha been a solid performer for the company this quarter his ability a a high performer on various task ha been extremely beneficial and reflective of his diverse skill set nolan ha shown a low potential for growth and development beyond the skill that he already posse however his strong contribution this quarter have been valuable to our company,train
223,Nolan Jacobson,"Category 3: 'Solid Performer' (High performance, Low potential)",FALSE,FALSE,2,469,4,2,0,nolan is a critical member to have on our team he is extremely conscientious about his work and is always willing to go the extra mile when i ask for extra volunteer on a lastminute project however i believe that nolan ha already met his peak here in the company since he seems a bit too shy and reserved to make it to the partner level partner need to be aggressive about business development and seeking new client and nolan would struggle in that capacity,train
225,Nolan Jacobson,"Category 3: 'Solid Performer' (High performance, Low potential)",FALSE,FALSE,2,544,5,2,0,nolan jacobson ha earned the solid performer rating for the evaluation period during this time he ha excelled at simple repetitive task require some degree of analytical and quantitative skill task at this level are rather straightforward with yes or no outcome he ha an above average ability to crunch large number of simple problem quickly while we think he ha the ability to do more he ha not demonstrated the desire to work on other assignment or invest in the personal relationship needed to accomplish team project,train
213,Emilia Davidson,"Category 3: 'Solid Performer' (High performance, Low potential)",FALSE,FALSE,2,366,5,2,0,emilia is is a great worker she is always on time is very detail oriented and consistently produce high quality work my only concern is that she doe not respond well to feedback and is a bit complacent she doe not seem to want to learn or improve and is happy with her current skill set she is a very skilled worker but is unlikely to improve or compromise,train
221,Nolan Jacobson,"Category 3: 'Solid Performer' (High performance, Low potential)",FALSE,FALSE,2,264,4,2,0,nolan jacobson ha kept production level consistent nolan can be counted on to complete his work and go beyond to provide more than is expected he ha high efficency and smash his goal nolans output is amazing i believe he is an asset to our company,train
220,Finley Gray,"Category 3: 'Solid Performer' (High performance, Low potential)",FALSE,FALSE,2,510,5,2,0,finley ha a usual produce quality work he is easily one of the smartest people in the office and his work rarely contains any error the team rarely ha any technical problem when finley is working with them however he doe not put in any effort to improve productivity or the quality of his work he is often uninterested and only speaks at work when he ha to although he is a smart guy he should seek to greatly improve his attitude towards his work rather than only working for the paycheck,train
