id,person_name,nine_box_category,adjusted,reviewed,label,feedback_len,num_of_sent,performance_class,potential_class,feedback_clean,data_type
452,Daniel Carr,"Category 6: 'High Performer' (High performance, Moderate potential)",FALSE,TRUE,5,377,4,2,1,daniel work is consistent and show he ha improved on his ability since starting with u he show interest in the work and can self motivate not just take instruction from supervisor daniel ha had impressive moment through his time here and seems eager to work more deeply in the future based on his high performance i believe he ha the potential to go far here,train
450,Daniel Carr,"Category 6: 'High Performer' (High performance, Moderate potential)",TRUE,TRUE,5,263,4,2,1,mr carr ha provided exceptional sell performance his number continue to impress he is most ideal for his current position and i expect that his performance will continue to advance however i do not see him a a candidate for upper management at this time,train
449,Daniel Carr,"Category 6: 'High Performer' (High performance, Moderate potential)",FALSE,TRUE,5,560,4,2,1,daniel is a rocksolid member of the team and is consistently one of the last people to leave the office whenever i get a report from him i can trust that it will be free of mistake and that he already factchecked each source and footnoted all citation to perfection i imagine that daniel will have no problem a a successful manager in the future but i question whether daniel is really fit to become a partner he often hesitant about taking on leadership role and lack the communication skill to be able to reach the highest level in this firm,train
448,Chelsea Ross,"Category 6: 'High Performer' (High performance, Moderate potential)",FALSE,FALSE,5,533,4,2,1,im so glad that we have chelsea a a member of our team whenever a client assigns u a really sophisticated research project i know that chelsea is the person i can count on to take that assignment on and deliver it with professionalism and efficiency i believe chelsea can move up within the next few year to become a manager however i dont think she ha what it take to become a director since she really struggle to balance multiple assignment at the same time and that is a critical skill to have for the director role,train
447,Chelsea Ross,"Category 6: 'High Performer' (High performance, Moderate potential)",FALSE,FALSE,5,287,4,2,1,chelsea ross performed at a high level this past year she is one of the most reliable and solid performer on my team she ha a firm grasp on the material and posse the skill set needed she definitely ha potential to continue to grow and possibly move up in the organization,train
446,Chelsea Ross,"Category 6: 'High Performer' (High performance, Moderate potential)",FALSE,FALSE,5,324,4,2,1,this worker always turn in great result they seem to really have motivation to get the job done and in a way that exceeds expectation their potential is possibly promising it seems they work themselves to the bone on the day to day but im not sure if there potential for growth with their span of thinking a it is,train
10029,Dylan Bailey,"Category 7: 'Potential Gem' (Low performance, High potential)",FALSE,FALSE,6,481,5,0,2,dylan ha not shown much potential but he doe seem to light up once he see the other worker start working and meeting their goal little progress is being made but it seems like he is inching his way higher and higher up the achievement latter a each day go by i think he may just be shy i think we should give him more time to get settled into the job to see what he can really do over time i dont want to pas up someone who may turn out to be a gem in the long run,train
10031,Dylan Bailey,"Category 7: 'Potential Gem' (Low performance, High potential)",FALSE,FALSE,6,545,4,0,2,dylan bailey seems to be an ideal candidate with a strong understanding of the fundamental and theoretical aspect of the work we are doing here by all account he should fit well but he ultimately seems to struggle and not perform a well a he should when working he underperforms and tends to provide minimal effort and make several mistake that are inconsistent with his level of experience mr bailey may struggle with the specific nature of the work we are doing but if he is provided assistance he may become an excellent employee,train
10032,Dylan Bailey,"Category 7: 'Potential Gem' (Low performance, High potential)",FALSE,FALSE,6,403,5,0,2,dylan ha a great personality and his communication skill are ideal for this company however it unfortunate that he often fails to complete a project by the deadline his team member often complain that he doesnt participate in email discussion or phone meeting his skill a a team leader in his previous job is certainly not showing he need to focus and understand company policy more,train
10033,Dylan Bailey,"Category 7: 'Potential Gem' (Low performance, High potential)",FALSE,FALSE,6,314,4,0,2,currently dylan is not performing up to company standard this is unfortunate because he show great potential for the future if dylan applies himself to reaching greater performance level he may indeed reach the potential he is capable of we see him achieving greater success in the future with more effort,train
10070,Makenna Justice,"Category 7: 'Potential Gem' (Low performance, High potential)",FALSE,FALSE,6,409,5,0,2,makenna had some issue getting started in our department her work product frequently had a lot of error and i noticed that her report were underdeveloped and underresearched that said im confident that she ha a ton of room for growth shes enthusiastic about the work and willing to make serious change based on feedback shes received i am confident that this cando attitude will serve her well,train
10071,Makenna Justice,"Category 7: 'Potential Gem' (Low performance, High potential)",FALSE,FALSE,6,508,5,0,2,makenna ha a lot of really good potential but the performance level are not quite there yet she seems to be motivated to do the work but there seems to be a bit of procrastination when it come down to actually doing the work i would like to see higher performance level before committing makenna to the team there are other high performer on the team and i do now want to drag them down with a teammate who ha low performance rate i think makenna can do better but i am still waiting to see it,train
10073,Makenna Justice,"Category 7: 'Potential Gem' (Low performance, High potential)",FALSE,FALSE,6,253,4,0,2,makenna justice is a dark horse but ha not yet proven herself a a team member and doing task she ha not shown full commitment yet we are hoping with the right help she can achieve great work we are looking to guide her further so she can improve,train
559,Logan Ellis,"Category 7: 'Potential Gem' (Low performance, High potential)",FALSE,FALSE,6,426,6,0,2,right now logan is a new worker who is not performing very well he is still learning the rope and is having trouble producing work on time he miss detail very often and make simple mistake however he ha shown a strong willingness to learn and improve he internalizes all feedback and proactively try to get better even though he is having trouble right now i think he will improve greatly with more experience,train
10111,Jayden Rees,"Category 7: 'Potential Gem' (Low performance, High potential)",FALSE,FALSE,6,328,3,0,2,jayden ha been a bit lackluster in his current role however i have seen what he can accomplish when he is inspired by a task and think that he could go very far indeed if he were in the right role consider a review with jayden to see what his goal are and how the company can support this it would be a shame to lose him,train
10153,Erin Harvey,"Category 7: 'Potential Gem' (Low performance, High potential)",FALSE,FALSE,6,344,4,0,2,erin ha struggled with general work output however despite her seemingly low work ability she ha consistently displayed an innate knowledge of business need i think she see the bigger picture more than her colleague and should be mentored with a view towards management in the future development on output would also help to this end,train
10156,Erin Harvey,"Category 7: 'Potential Gem' (Low performance, High potential)",FALSE,FALSE,6,355,4,0,2,this is a difficult job with a steep learning curve training erin though it very apparent she is intelligent and cognizant of what it is she need to do she asks all of the right question and when she make a mistake she corrects her thought process to avoid such ordeal in the future given a few more month erin will be a star at this company,train
10192,Daniel Hill,"Category 7: 'Potential Gem' (Low performance, High potential)",FALSE,FALSE,6,282,3,0,2,daniel hill ha come far and ha it in him to be a real star player here while he ha great enthusiasm and practical solution he oftentimes down not put the work in and get this hand dirt with the rest of the team hopefully he can pick up on the behavior of those around him,train
10193,Daniel Hill,"Category 7: 'Potential Gem' (Low performance, High potential)",FALSE,FALSE,6,326,5,0,2,daniel ha shown terrific improvement this month he ha solved one of the p1 bug with relative ease sadly due to his carelessness he introduced a totally avoidable p2 the following week he just need to iron out a few kink and improve his concentration once he focus i am certain he will be a real asset in no time,train
10074,Makenna Justice,"Category 7: 'Potential Gem' (Low performance, High potential)",FALSE,FALSE,6,371,5,0,2,makenna justice ha both much to be impressed by and much to be desired they are a potential gem in the workplace there are time where they may let the group down or maybe not pull their weight the time that they really pull it together though it can push our group to new height with a little work they could be one of the strongest employee this company ha,train
10113,Jayden Rees,"Category 7: 'Potential Gem' (Low performance, High potential)",FALSE,FALSE,6,215,4,0,2,jayden is a very promising worker he ha great memory and learns a lot of new stuff in a very short time his effectiveness right now is a bit low he need a little more time to catch up with the rest of out team,train
557,Logan Ellis,"Category 7: 'Potential Gem' (Low performance, High potential)",FALSE,FALSE,6,542,4,0,2,logan lag behind her colleague every time her job requires her to learn a new software program shes unable to master the program quickly and this can hinder her ability to generate report that are accurate and timely however i appreciate the enthusiasm logan ha for the job and her strong work ethic mean shes always willing to stay late and put in extra hour to learn the software a quickly a shes able i see her work ethic being an asset in the future so i believe she ha a lot of opportunity for promotion in the future,train
553,Briley Mcknight,"Category 7: 'Potential Gem' (Low performance, High potential)",FALSE,FALSE,6,554,5,0,2,briley ha had a number of issue learning the rope of our new software package the report that shes generated this quarter have often been late moreover when ive factchecked her work ive found some glaring computational error however briley ha really been proactive about making sure she learns the new software and shes enrolled in a training next month to get a better handle on it once she doe im confident that shell be able to make great improvement in her work since this is the only aspect of her work thats holding her back,train
554,Briley Mcknight,"Category 7: 'Potential Gem' (Low performance, High potential)",FALSE,FALSE,6,204,3,0,2,briley mcknight is one of the good coworker in our office though he ha a lot of potential he doesnt implement on his work if he improved himself better he is one of the finest worker in our office,train
534,George Jones,"Category 7: 'Potential Gem' (Low performance, High potential)",TRUE,TRUE,6,429,5,0,2,george doe not complete work on time and need to be constantly supervised he doe show high potential due to the work he doe eventually submit george is very intelligent but some incentive should be made to get him to realize his potential george could probably choose a different career path within the company to ignite his ambition george might seem lazy sometimes but show high potential of being a great contributor,train
537,Brantley Whitfield,"Category 7: 'Potential Gem' (Low performance, High potential)",FALSE,TRUE,6,417,7,0,2,brantley ha been with the firm for a year he ha proved himself to be intelligent quicklearning highly responsive he is a great communicator though due family issue brantley ha not given his 100 he ha been lagging in delivering his work he ha been absent in meeting and occasional for work recommend that we allow him time to sort out his family issue and come back to contribute to the firm fully,train
538,Brantley Whitfield,"Category 7: 'Potential Gem' (Low performance, High potential)",TRUE,TRUE,6,222,4,0,2,brantley whitfield is always late he rarely delivers project on time he need to focus more on his work and double check before delivery i can see his having very high potential a he doe work very hard when motivated,train
540,Brantley Whitfield,"Category 7: 'Potential Gem' (Low performance, High potential)",FALSE,TRUE,6,344,4,0,2,brantley continues to be le productive than i believe he could be he is intelligent and when he push himself he ha been able to suggest way to increase productivity and profit in his department if he improves in his productivity he could become an invaluable asset to the company he may need some guidance to find his ideal position,train
541,Brantley Whitfield,"Category 7: 'Potential Gem' (Low performance, High potential)",FALSE,TRUE,6,408,4,0,2,brantleys time with our organization could be characterized a unusual in both good and bad way on one hand he hasnt shown much in the way of number or standout work on the other he doe show strong aptitude and interest in learning to contribute to our organization in other way while his performance may be low it may be a good idea to give him a chance when put in a better position to succeed,train
539,Brantley Whitfield,"Category 7: 'Potential Gem' (Low performance, High potential)",FALSE,TRUE,6,527,6,0,2,brantleys confidence issue have really impacted his performance in a negative way he a new member of the team so ill cut him some slack but he constantly questioning whether he approaching his assignment in the right way moreover his selfdoubt impact the impression that he give to client so im always nervous to have him with me in meeting fortunately i think brantley ha a ton of room to grow there is absolutely no reason for him to have shaky confidence since his work product is always outstanding,train
543,Kallie Beard,"Category 7: 'Potential Gem' (Low performance, High potential)",FALSE,TRUE,6,594,5,0,2,kallie struggled significantly this quarter however she did make a couple of improvement while she ha made many error in charting change over time she take feedback well and look at her work more critically after her mistake are acknowledged additionally she ha sought help from other member in the office if she is unclear about a situation or need guidance her willingness to find solution for her mistake make her an excellent candidate to continue with the organization overall kallie doe have significant improvement to make however she is on the right path to do so,train
544,Kallie Beard,"Category 7: 'Potential Gem' (Low performance, High potential)",FALSE,TRUE,6,344,4,0,2,kallie within the past term hasnt quite adjusted to our team yet she seems to still be fitting into the workload and finding a place to really catch a stride because of this her performance isnt quite at our team expectation yet however she posse skill and an attitude that can immensely pay off very soon once she learns the rope,train
545,Kallie Beard,"Category 7: 'Potential Gem' (Low performance, High potential)",FALSE,FALSE,6,432,4,0,2,kallie ha really had a hard time with every task involving excel that ive given her many of her report are riddled with quantitative error fortunately i think that her performance is about to really take off since she ha been working under the mentorship of our inhouse excel guru who really taken her under his wing once kallie understands how to properly use excel i think her work product will improve significantly,train
547,Braiden Santos,"Category 7: 'Potential Gem' (Low performance, High potential)",FALSE,FALSE,6,265,4,0,2,braiden ha shown high potential this quarter while he hasnt reached quota his solution for internal problem have been excellent he ha a big future in the industry and is worth the growth period a short term investment that will produce long term value,train
548,Braiden Santos,"Category 7: 'Potential Gem' (Low performance, High potential)",FALSE,FALSE,6,381,5,0,2,braiden is a new member of our department who ha struggled to get his bearing many of the report ive received from him have a lot of math error he working really hard to get his quantitative skill up to par though he signed himself up for a math boot camp taking place next month i love his enthusiasm for learning and can see that taking him far in this organization,train
549,Braiden Santos,"Category 7: 'Potential Gem' (Low performance, High potential)",FALSE,FALSE,6,257,4,0,2,braiden is a bit of an odd case on one hand his number show that he isnt doing especially well in his duty on the other he ha shown an excellent capacity for growth and improvement in other area he might possibly one day grow into a top performer,train
552,Briley Mcknight,"Category 7: 'Potential Gem' (Low performance, High potential)",FALSE,FALSE,6,241,4,0,2,basically briley mcknight have high potential in his work experience but in recent day he is doing low performance in his core i think he have to update more in his core area he have to concentrate little more in new updated technology,train
624,Dennis Buchanan,"Category 8: 'High Potential' (Moderate performance, High potential)",FALSE,FALSE,7,185,4,1,2,dennis buchanan performance ha not reached it full potential yet however it is very clear that he is capable of a lot more the expectation are high the potential is very great,train
629,Chanel Cleveland,"Category 8: 'High Potential' (Moderate performance, High potential)",FALSE,FALSE,7,387,5,1,2,chanel ha shown great improvement this year her willingness to learn and work hard show that she ha high potential in this company chanel ha taken unpaid time to work and learn in order to grow at her job while her actually performance ha been moderate i expect it to get better a time go by chanel will be a good candidate for a promotion if she continues on this track,train
628,Chanel Cleveland,"Category 8: 'High Potential' (Moderate performance, High potential)",FALSE,FALSE,7,282,5,1,2,one of the thing i admire about chanel cleveland is his aptitude for problem solving in a proactive way he know what he doe and take time to operate every task i think that is the reason why he perfors so good he should any way learn to work with others but he work well,train
627,Chanel Cleveland,"Category 8: 'High Potential' (Moderate performance, High potential)",FALSE,FALSE,7,343,4,1,2,chanel is a bubbly fun smart and capable worker she ha proven herself capable of taking risk and delivering under pressure in the past six month she ha undertaken two major project due to a number of reason the project did not come to fruition however she ha acquired invaluable skill and leadership by taking those project,train
626,Chanel Cleveland,"Category 8: 'High Potential' (Moderate performance, High potential)",FALSE,FALSE,7,252,6,1,2,chanel cleveland is a hard worker she ha good potential but ha not yet reached her top potential with greater training and time she could be a high performing worker she work well with the team her work is quality she completes task on time,train
625,Chanel Cleveland,"Category 8: 'High Potential' (Moderate performance, High potential)",FALSE,FALSE,7,357,5,1,2,chanel is a great person to work with he can view possible bottleneck in the flow very quickly and can resolve the same with everybodys agreement very quickly he understands multiple view point clearly however he is flexible to accommodate all view point into his final solution overall a very nice person to work with and can progress much quickly,train
623,Dennis Buchanan,"Category 8: 'High Potential' (Moderate performance, High potential)",FALSE,FALSE,7,373,6,1,2,dennis joined the company last year since then dennis ha proven himself an invaluable asset he is well liked and respected by his peer and project lead he ha worked tirelessly and grown tremendously at work due to unfortunate circumstance dennis ha failed to deliver a number of project on time with more time on the job dennis will reach his full potential,train
615,Alina Britt,"Category 8: 'High Potential' (Moderate performance, High potential)",FALSE,FALSE,7,392,3,1,2,alinas work for this project wa not a good a her previous work however it is still very much usable alinas work in the past ha been remarkable she pay close attention to detail triple check her work and always make sure her work is a clear and concise a it can be i always look forward to working with alina because her work is a i stated before quite well put together,train
621,Dennis Buchanan,"Category 8: 'High Potential' (Moderate performance, High potential)",FALSE,FALSE,7,363,4,1,2,dennis is a consistently reliable a an employee his work product is always above par and his dedication and commitment to his work is show by his work output dennis is a team player and get along with all member of the team willing to assist and help when needed he is a leader and reflects quality that would make him a great supervisor for the team,train
620,Dennis Buchanan,"Category 8: 'High Potential' (Moderate performance, High potential)",FALSE,FALSE,7,526,5,1,2,i believe dennis did well however he could also have done better i recommend that he take his time with his next project a this one felt a bit rushed i think that if he took his time with this project the result would have been better overall dennis seems to have no problem grasping how to complete project rather he seems to rush through them which unfortunately reduces his quality of work i do look forward to his next project though a long a he can take his time with it he should get better feedback,train
619,Alina Britt,"Category 8: 'High Potential' (Moderate performance, High potential)",FALSE,FALSE,7,400,4,1,2,you are proactive and do not require constant supervision you have demonstrated that you can meet our basic objective of all new hire and a willingness to take on additional work you meet your deliverable and have shown that you are willing to help other colleague within the organization you communicate well with your peer and immediate supervisor and should look to expand your network,train
618,Alina Britt,"Category 8: 'High Potential' (Moderate performance, High potential)",FALSE,TRUE,7,268,4,1,2,alina ha been doing a great job keeping up with the other employee she ha remained on time with all task asked alina continues to show progress in all area she could continue to improve in other area a far a taking on a higher work load without being asked,train
617,Alina Britt,"Category 8: 'High Potential' (Moderate performance, High potential)",FALSE,FALSE,7,274,4,1,2,alina britt ha the tendency to reach all goal in a timely fashion alina ha shown great progress over the last quarter and prof that she can improve in something that she set her mind to she ha provided great number a well we are excited to see what alina can do,train
616,Alina Britt,"Category 8: 'High Potential' (Moderate performance, High potential)",FALSE,FALSE,7,251,5,1,2,alina is a great asset to this company she work well with other team member alina ha no problem finishing task assigned to her she think on her toe and always find a solution to a problem at hand she is very dependable and well organized,train
632,Jamari Roberts,"Category 8: 'High Potential' (Moderate performance, High potential)",FALSE,FALSE,7,388,5,1,2,jamari is a wonderful people person a great salesman quick study a great communicator though his sale record have been lackluster for several reason a pandemic economic downturn lack of demand jamari ha shown interest in improving the company sale system he ha used his personal time conducting research i hope his effort will translate into profit for the company,train
613,Yahir Harvey,"Category 8: 'High Potential' (Moderate performance, High potential)",FALSE,FALSE,7,316,3,1,2,yahir is smart easy going and ha great communication skill for the past year yahir ha worked on a number of major project he ha consistently shown he is able to come up with creative solution and deliver the goal yahir could improve upon his accuracy at work and be more receptive of coworkers feedback,train
622,Dennis Buchanan,"Category 8: 'High Potential' (Moderate performance, High potential)",FALSE,FALSE,7,257,5,1,2,dennis buchanan is a person with a lot of potential i see it in the way he act he is just waiting for his time to come and he will be great dennis will one day be great and i can not wait to see what the future ha for him he certainly ha potential,train
10034,Moises Houston,"Category 8: 'High Potential' (Moderate performance, High potential)",TRUE,TRUE,7,249,4,1,2,moises houston ha been instrumental in the success of the company at present his work ethic ha been a straight line and ha not dipped we can see he can show further we will develop his achievement and give him the support he need to succeed,train
