id,person_name,nine_box_category,adjusted,reviewed,label,feedback_len,num_of_sent,performance_class,potential_class,feedback_clean,data_type
1,John Doe,"Category 1: 'Risk' (Low performance, Low potential)",FALSE,TRUE,0,287,5,0,0,john ha not progressed in his position he is continuously late leaf early and take many break throughout the day he call out at least every other week and it always on friday his performance ha significantly declined my suggestion is he is not suitable for this position,train
10045,Douglas Henry,"Category 1: 'Risk' (Low performance, Low potential)",FALSE,FALSE,0,430,6,0,0,douglas henry ha been having trouble in all area of the job he rarely arrives at work on time he often phone in sick and try to make excuse to leave early douglas ha not had good feedback from his immediate superior about the quality of his work he lack concentration and is often seen daydreaming in short it seems that douglas henry is not a good employee for this company and should be let go a soon a possible,train
10044,Douglas Henry,"Category 1: 'Risk' (Low performance, Low potential)",FALSE,FALSE,0,290,4,0,0,douglas ha a lot to work on and area to grow in at work he lack the drive to accomplish any task with sound quality he come to work with an apathetic attitude and applies that to his daily task due to his lack of initiative we do not think he ha much of a future with our company,train
10005,Freddie Davies,"Category 1: 'Risk' (Low performance, Low potential)",FALSE,TRUE,0,418,5,0,0,freddie is a nice guy but his performance and potential level are ver poor i am not seeing much motivation to perform nor am i seeing the potential to want to perform either i think he may be too risky for our team at this time if i saw more potential there i would say let keep him on so we can see what he doe in the long run however i am not seeing enough motivation or positivity from him at this time,train
10004,Freddie Davies,"Category 1: 'Risk' (Low performance, Low potential)",FALSE,FALSE,0,449,4,0,0,freddie ha been quite disappointing this quarter quite being an understatement while the whole team is flooded with phone call due to the ongoing pandemic he ha taken 7 unplanned leaf citing personal emergency which turned to be a blatant lie according to his social medium account workwise his output is alarmingly lower than the next worst performer in the team freddie should redeem himself swiftly if he a to continue in this team,train
326,Dylan Baker,"Category 1: 'Risk' (Low performance, Low potential)",TRUE,TRUE,0,181,4,0,0,he is not helpful dylan is not a teamplayer he doe not incorporate feedback he is reliable most of the time but would be better if he listened to feedback and cooperated more,train
285,Isobel Foster,"Category 1: 'Risk' (Low performance, Low potential)",TRUE,TRUE,0,533,7,0,0,isobel foster what a player to have easily one of the worse player that i have ever coached he doe not give enough effort on the defense end that opposing player will exploit it and get easy bucket whenever the team fall down into double digit he give up too easily and just put no effort into his game while his offense can be refined to be a decent scorer his defensive end dictate his effort into the game he might be an option for just scoring when the lead is higher but dont expect him to be greater than that,train
264,Carl Thorn,"Category 1: 'Risk' (Low performance, Low potential)",TRUE,TRUE,0,308,4,0,0,mr thorn is somewhat over his head he is typically unable to perform the essential function of his job that said he ha shown a willingness to learn it would probably be worth it to the organization to provide him with additional support and re evaluate to see if that might improve his performance,train
158,Joel Wells,"Category 1: 'Risk' (Low performance, Low potential)",TRUE,TRUE,0,177,4,0,0,joel well performance is not where we want it to be his work is not always up to standard he work slowly and doe not work well with the team his communication is lacking,train
155,Amy John,"Category 1: 'Risk' (Low performance, Low potential)",TRUE,TRUE,0,309,4,0,0,he ha the attitude of doing only what ha been told but he is expected to do something implied and not specifically told even after repeated instruction what ha been missing implied even specifically not told he lag understanding his capacity to think beyong the specification lag his development,train
153,Amy John,"Category 1: 'Risk' (Low performance, Low potential)",TRUE,TRUE,0,264,6,0,0,amy john is a mediocre worker she doe not try to go above and beyond what is asked of her she often doe the minimum of task asked of her she doe not volunteer to take on task she doe not work well with the team her work is not at the standard we expect,train
87,Broderick Hays,"Category 1: 'Risk' (Low performance, Low potential)",FALSE,FALSE,0,385,5,0,0,even my friend deepen graduated from college he could not find a suitable job he doesnt concentrated on the subject while he wa studying in college he doesnt attend the campus interview held at the college by his laziness so it wa very difficult for him to get a perfect job it is very sad to hear that he is currently struggling to find a suitable job relevant to his study,train
85,Broderick Hays,"Category 1: 'Risk' (Low performance, Low potential)",FALSE,FALSE,0,204,4,0,0,broderick hay is always late he is always making error in his project he doe not collaborate with member on task and doe not listen to advice i do not see him a being a good asset for our firm,train
83,Broderick Hays,"Category 1: 'Risk' (Low performance, Low potential)",FALSE,FALSE,0,421,4,0,0,brodericks work this project wa not usable by the company due to it low quality unfortunately this is not out of the ordinary for broderick his work is usually not of high quality and therefore this project wa more to keep him busy and test his performance and potential than to actually use it i do not think broderick ha proved his worth on this team although he ha certainly been here long enough to do so,train
81,Mackenzie Jennings,"Category 1: 'Risk' (Low performance, Low potential)",FALSE,FALSE,0,500,5,0,0,im always nervous when assigning mackenzie a report when shes turned her draft back to me i frequently find a lot of glaring typo and miscalculation that would be easy for her to catch if she did any proofreading i find that i cant trust her to turn work into client without assigning at least two other colleague to review it first this is a waste of resource and worse she doesnt seem to really care about making any improvement thus i dont see her moving far in this organization,train
80,Mackenzie Jennings,"Category 1: 'Risk' (Low performance, Low potential)",FALSE,FALSE,0,276,4,0,0,mackenzie ha trouble staying on task and completing her duty she is wellliked by her coworkers but spends too much time socializing mackenzie doe not seem to be serious about advancing in the company she need more instruction on how to adequately complete her duty,train
79,Mackenzie Jennings,"Category 1: 'Risk' (Low performance, Low potential)",FALSE,FALSE,0,277,4,0,0,mackenzie is an awful employee he always late doe not produce quality work and doe not work well with others not only that he constantly ignores feedback from supervisor and show no desire to learn or improve himself he is a very worker who will likely not improve,train
77,Jalen Summers,"Category 1: 'Risk' (Low performance, Low potential)",FALSE,FALSE,0,405,4,0,0,jalen summer ha fallen very short on all of our company standard this quarter the amount of work she manages to actually get done is substandard and she need constant hand holding having her in the office mean somebody at some point will most likely have to sacrifice their time helping her figure something out that she should be able to do on her own she is a serious risk to the organization,train
76,Jalen Summers,"Category 1: 'Risk' (Low performance, Low potential)",FALSE,FALSE,0,472,5,0,0,every time i ask jalen to complete a report i already know that i will need to ask at least one other member of the team to back him up he consistently late on his assignment and he rarely spellchecks or proofreads any of his work unfortunately his poor attitude toward work doesnt help matter when ive spoken with him about his performance he ha simply shrugged and given me oneword response i dont see jalen moving up far in this organization a a result,train
75,Jalen Summers,"Category 1: 'Risk' (Low performance, Low potential)",FALSE,TRUE,0,180,4,0,0,jalen summer performance did not meet standard it wa subpar and need a lot of work there is not much potential in that particular performance he doe not get a good review,train
10047,Douglas Henry,"Category 1: 'Risk' (Low performance, Low potential)",FALSE,FALSE,0,479,4,0,0,douglas ha shown inconsistent performance throughout the review period at the time of review multiple documented conversation have occurred regarding the quality and timeliness of submitted documentation two additional conversation have occurred regarding appropriate communication and timely follow up when requested to provide information either via phone or email douglas will need to significantly improve the quality and timeliness of his work to maintain employment,train
74,Jalen Summers,"Category 1: 'Risk' (Low performance, Low potential)",FALSE,TRUE,0,434,5,0,0,jalen summer performance this quarter wa substandard on two occasion he wa asked to prepare basic discovery request and missed both deadline he wa given whats more jalen is consistently unenthusiastic when asked to stay past regular hour to complete important casework more often than nearly anyone jalen also take sporadic vacation day to deal with personal issue in my view jalen is not long for this firm,train
10048,Douglas Henry,"Category 1: 'Risk' (Low performance, Low potential)",FALSE,FALSE,0,233,4,0,0,douglas henry has disappointed us this quarter he lack motivation to complete his work lately and seems apathetic his attendance is slipping a well and weve issued multiple warning if this continues we may have to let him go,train
10084,Layla Scott,"Category 1: 'Risk' (Low performance, Low potential)",FALSE,FALSE,0,285,4,0,0,i feel like layla may have overpromised during her interview she is often found on extended break or on her phone with little drive or interest to accomplish the job she often barely squeak by with minimal accomplishment maybe she should consider something else more appropriate,train
20047,Cason Vargas,"Category 1: 'Risk' (Low performance, Low potential)",FALSE,TRUE,0,238,4,0,0,carson ha not been working out very well in my evaluation he is not very punctual and is oft absent his work quality is poor and so too is his effort i do not believe he is a viable investment and is not worth the time and resource,train
20045,Cason Vargas,"Category 1: 'Risk' (Low performance, Low potential)",FALSE,TRUE,0,425,4,0,0,casons performance has been nothing short of disappointing in the past quarter he is perpetually distracted and ha not met the deadline even once in the last month when he did meet the deadline his work failed to pas the quality control checkpoint at this rate it would be a necessity to find a suitable replacement for cason unless he doe something miraculous to up his performance on par with the best performer,train
20043,Cason Vargas,"Category 1: 'Risk' (Low performance, Low potential)",FALSE,TRUE,0,599,5,0,0,cason vargas is a software developer for our customer service team he started here last fall and ha been responsible for improving user interface error and bug on various customer service application operated on different type of technology website mobile website mobile app and instore machine he ha attended to multiple customer but i have received feedback that many bug remain on the company technology and some customer are not satisfied with their user experience i have also noticed cason missing a few staff meeting im concerned about his work record this quarter,train
20028,Rowan Cain,"Category 1: 'Risk' (Low performance, Low potential)",TRUE,TRUE,0,484,3,0,0,mr cain started with the company last month and every day ha been a ray of sunshine until it time to get to work mr cain give 110 percent to every task he like and is always there to help people when he feel like it if a customer is not to his liking or if it is a thursday mr cain is rude in manner and ha to be removed from the floor we wish we could see more consistent performance from mr cain a right now we are frustrated with his inconsistent performance,train
20005,Jude May,"Category 1: 'Risk' (Low performance, Low potential)",FALSE,TRUE,0,473,6,0,0,jude has potential but need coaching in several area their quality of work is very poor with many mistake i have talked to jude on many occasion about their work quality and they are defensive and deny the mistake even when i have shown several example jude also need to act in a more professional manner they do not take any sort of feedback well jude should not be given a raise this year and need to complete a rigid coaching program to continue employment,train
20003,Jude May,"Category 1: 'Risk' (Low performance, Low potential)",FALSE,TRUE,0,156,4,0,0,jude is an embarrassment he never even try or care at his job if he keep this up he wont have a future here in the company such a waste of potential,train
20002,Jude May,"Category 1: 'Risk' (Low performance, Low potential)",FALSE,TRUE,0,442,4,0,0,jude may has not been working to a satisfactory level and must improve on all aspect on their work the worker in question need to show a better attitude and more positive outlook to the work and make sure it completed in a timely manner with better detail jude can and must show a willingness to progress further we can look at this again in the future and we can see how we can work with the individual to make the improvement needed,train
20001,Jude May,"Category 1: 'Risk' (Low performance, Low potential)",FALSE,TRUE,0,400,4,0,0,jude has been disappointing in the key aspect of her work despite being allocated to a number of different task she ha failed to demonstrate a satisfactory level of output her engagement with the job ha been poor and she show little interest in developing even though these opportunity have been provided there doe not seem to be much benefit to retaining jude in the short or long term,train
10210,Jaiden Horne,"Category 1: 'Risk' (Low performance, Low potential)",FALSE,FALSE,0,358,4,0,0,jaiden has been repeatedly failing to deliver what has been asked of him and show little to no interest in the assignment the team had to work extra hour because of his lacklustre performance this quarter a simple 1day task take 34 day when assigned to jaiden i believe if this sort of abysmal work continues he may have to start looking elsewhere,train
10208,Jaiden Horne,"Category 1: 'Risk' (Low performance, Low potential)",FALSE,FALSE,0,299,4,0,0,jaiden showed this quarter that he really cannot perform well im sorry to say that but hiring that guy isnt good for our company what ive understood is that even if he put more effort into his work he wont do good so i dont know what to tell you except that i maybe recommend firing him,train
10207,Jaiden Horne,"Category 1: 'Risk' (Low performance, Low potential)",FALSE,FALSE,0,194,4,0,0,jayden horne is not a team player she has shown that her competence is below the level that is required at present the task she ha completed are below average with time jaiden will improve,train
10169,Katherine Terry,"Category 1: 'Risk' (Low performance, Low potential)",FALSE,FALSE,0,303,5,0,0,katherine consistently miss her deadline she show no sign of caring about improving her subpar work the quality of her performance is always lower than the rest of her team she is not proficient at organizing spreadsheet which wa listed on her resume she is late to work more time than not,train
10168,Katherine Terry,"Category 1: 'Risk' (Low performance, Low potential)",FALSE,FALSE,0,567,6,0,0,katherine struggle to meet the minimum requirement of her role on several occasion she did not perform in accordance with company standard and this resulted in significant rework katherine is perceived a someone who cannot be relied upon and this ha created a toxic atmosphere in her team katherine ha indicated that she is not willing to work on her performance for these reason katherine must be seen a both a low performer and a worker with low potential at this stage unfortunately it is concluded that katherine would be at risk of redundancy,train
10167,Katherine Terry,"Category 1: 'Risk' (Low performance, Low potential)",FALSE,FALSE,0,209,3,0,0,katherine has a bad attitude towards work and ha caused some concern on the team her everyday performance is low in quality and attempt at training have been unsuccessful high priority on redundancy list,train
10140,Lexi Rogers,"Category 1: 'Risk' (Low performance, Low potential)",TRUE,TRUE,0,282,4,0,0,lexi rogers doe not meet expectation with the task given to her rogers lack consistency in her work and communication it is clear to me that more training is required of her until she can meet expectation if she doe not work up to the expectation she should be terminated,train
10127,Marc Hughes,"Category 1: 'Risk' (Low performance, Low potential)",FALSE,FALSE,0,210,4,0,0,marc hughes is not showing the intent that is needed at this level overall his work ha shown little talent he will do well to continue developing his skill at this time the work ha been irregular at best,train
10126,Marc Hughes,"Category 1: 'Risk' (Low performance, Low potential)",FALSE,TRUE,0,163,2,0,0,your achievement are well below the normal average none of your activity meet quality standard your creativity is null your communication skill are very poor,train
10125,Marc Hughes,"Category 1: 'Risk' (Low performance, Low potential)",FALSE,FALSE,0,358,4,0,0,marc need a lot of improvement for next quarter he need improvement on listening and using objective language when writing the session note another area to improve on is conducting the therapy session with the kid marc is great with the child however he could improve on his multitasking with playing with the kid and working on the protocol,train
10087,Layla Scott,"Category 1: 'Risk' (Low performance, Low potential)",FALSE,FALSE,0,318,4,0,0,layla scott often show up to work late often without an valid email or notification leaving the team wondering we sometimes could not see her in her office for a long period of time her performance were underwhelming it take her three time than average worker time to finish half of a regular assigned task,train
10085,Layla Scott,"Category 1: 'Risk' (Low performance, Low potential)",FALSE,FALSE,0,335,4,0,0,layla scott is an underachiever and doe the bare minimum at best she seldom come to work early and we are lucky if she come on time at all she is constantly calling off shift for work with little notice she ha very low potential of ever becoming a good waitress simply because she refuse to listen to advice or instruction,train
10059,Amelie Martin,"Category 1: 'Risk' (Low performance, Low potential)",TRUE,TRUE,0,437,8,0,0,amelie is a fickle minded person she come late to the office very often is irregular in attending meeting not listening properly unable to answer client query in meeting on email unable to maintain proper balance between work personal life unprofessional behavior with colleague senior this is in spite of the fact that she ha some talent in her to produce better result need to be guided in proper direction,train
70,Tom Barrett,"Category 1: 'Risk' (Low performance, Low potential)",FALSE,FALSE,0,368,4,0,0,tom barrett ha been struggling in his position his work is rarely up to the minimum acceptable level he make too many error and is reluctant to accept criticism thus hampering his ability to improve he seems distracted at work and is often late completing task when all others have long finished overall i can not see any prospect of improvement in the future,train
33,Kayden Hill,"Category 1: 'Risk' (Low performance, Low potential)",FALSE,TRUE,0,185,4,0,0,kayden hill struggle with the task set before him he is easily frustrated and tends to want to give up he is aloof with his team he seems unhappy with where he is within the team,train
32,Kayden Hill,"Category 1: 'Risk' (Low performance, Low potential)",FALSE,TRUE,0,419,4,0,0,kayden ha consistently failed to deliver on a numerous amount of task around the office he show up with a standoffish attitude and constantly fails to meet expected deadline additionally the quality of his submission ha been decreasing greatly over the last few month i do not currently see kayden a an individual who i expect to succeed in the office and i do not believe that he is an asset to the team,train
31,Kayden Hill,"Category 1: 'Risk' (Low performance, Low potential)",FALSE,TRUE,0,455,3,0,0,kayden hill ha shown no improvement over the last quarter she ha continued to perform at the lowest standard possible and show no desire to better herself or seek assistance to improve every single area of her work need immediate improvement if there is no improvement shown i feel that we have no choice to dismiss this employee a her low performance and work ethic could soon become harmful to the company and effect the work ethic of her peer,train
30,Broderick Hays,"Category 1: 'Risk' (Low performance, Low potential)",FALSE,TRUE,0,165,4,0,0,need to apply himself at work too distracted and no indication that thing will improve possible retraining needed we need to see that broderick can work well,train
29,Broderick Hays,"Category 1: 'Risk' (Low performance, Low potential)",FALSE,TRUE,0,266,4,0,0,broderick hay ha been a member of our team for the past year he ha demonstrated a lack of motivation during work hour there have been several customer complaint due to unresolved issue unfortunately we are unable to continue his employment at this time,train
28,Broderick Hays,"Category 1: 'Risk' (Low performance, Low potential)",FALSE,TRUE,0,193,4,0,0,mr hay is always running late or missing work mr hay ha yet to hand in an assignment on time mr hay put in little effort and work to his assignment doesnt appear to enjoy this job,train
26,Mackenzie Jennings,"Category 1: 'Risk' (Low performance, Low potential)",FALSE,TRUE,0,388,5,0,0,mackenzie ha been frustrating to work with in the last quarter shes frequently late to return assignment and doe not attend meeting on time her work product is riddled with typo when ive asked her to make correction shes slow to do so and shes often confused about my instruction unfortunately i believe that mackenzie doe not have the ability to improve much from here,train
25,Mackenzie Jennings,"Category 1: 'Risk' (Low performance, Low potential)",FALSE,TRUE,0,193,4,0,0,where do i start mackenzie is detrimental to our company she is not meeting any of her company goal and i do not see how she can improve i would not recommend rehiring her for any position,train
24,Jalen Summers,"Category 1: 'Risk' (Low performance, Low potential)",FALSE,TRUE,0,576,6,0,0,the report that jalen turn in to me usually reflect a very poor effort for example theyre filled with basic spelling error the font randomly change from page to page and the formatting and spacing are often inconsistent this is always frustrating because correcting these error take a significant amount of time when ive spoken to jalen about the importance of reviewing and proofreading work he ha blown me off and continued to submit subpar work unfortunately his lack of willingness to change show me that he not invested in moving up in this company,train
22,Jalen Summers,"Category 1: 'Risk' (Low performance, Low potential)",FALSE,FALSE,0,206,3,0,0,i think that jalen should be trained more so a to perfect his skill i believe that people with low quality skill are willing to learnso that should not be a problem with him i say give him more time,train
21,Tom Barrett,"Category 1: 'Risk' (Low performance, Low potential)",FALSE,TRUE,0,315,4,0,0,tom doe not show any potential in his job performance tom never seems to be caught up with the team and is always behind on his work tom ha a bad attitude and continues to make excuse for his performance tom need more training to make sure we are offering everything to help him be successful in this career,train
20,Tom Barrett,"Category 1: 'Risk' (Low performance, Low potential)",FALSE,TRUE,0,247,4,0,0,tom barrett ha a problem with keeping up i wish he would just take more action and work harder but it seems something is holding him back unfortunately he is not going to be a good longterm worker if only he wa more focused and determined,train
18,Libby Parker,"Category 1: 'Risk' (Low performance, Low potential)",FALSE,TRUE,0,292,5,0,0,libby we must talk about your performance your number do not reflect the amount of time you are spending on task the quality of your work is so low we may need to let you go let see what we can do to improve your work you can be a much better performer if you work with u to improve,train
17,Libby Parker,"Category 1: 'Risk' (Low performance, Low potential)",FALSE,TRUE,0,322,5,0,0,libby started off well but no longer ha motivation to perform well she show no sign of interest and ha no ambition she is performing poorly and doesnt show effort in her work she no longer take the job serious she need to change her work ethic soon or else she will no longer have a job within our institution,train
